<?xml version="1.0" encoding="UTF-8"?>
<movies xmlns="http://www.tpo.com/movies"
	xmlns:xsi="http://www.w3.org/2001/XMLSchema-instance"
	xsi:schemaLocation="http://www.tpo.com/movies movies.xsd ">
	<movie mid="122">
			<title>Nagend922992</title>
			<director>OMaka</director>
			<year>2001</year>
			 <language>Hindi</language>	
			 <language>English</language>
			 <language>Chinese</language>
	</movie>
	
	<movie  mid="908">
			<title>Opwoeie</title>
			<director>OMaka</director>
			<year>2020</year>
			 <language>Hindi</language>	
			 <language>English</language>
			 <language>Chinese</language>
	</movie>
	
</movies>
